01: Vysvětli pojem nebo část: Základní pojmy / Kyberprostor	<b>– Obecné principy zajišťování bezpečnosti a dostupnosti digitálních aktiv</b><br><br>Kyberprostor má <b>3 vrstvy</b>:<br>1. <b>Fyzická</b> – umístění síťových prvků a komponent (servery, routery, kabely, datová centra)<br>2. <b>Logická</b> – logické propojení mezi síťovými uzly (IP adresy, směrování, komunikační kanály)<br>3. <b>Sociální</b> – osoby na síti (e-mailové adresy, IP adresa, číslo telefonu, uživatelé)<br><br>&gt; <b>KYBERPROSTOR = INTERNET = WEBOVÉ SLUŽBY</b>	01 01_obecne_principy_bezpecnosti kyber
01: Vysvětli pojem nebo část: Základní pojmy / Kybernetická bezpečnost	<b>– Obecné principy zajišťování bezpečnosti a dostupnosti digitálních aktiv</b><br><br>Kybernetická bezpečnost je možné vymezit jako:<br>- <b>Souhrn právních, organizačních, technických a vzdělávacích prostředků</b>, které směřují k zajištění ochrany počítačových systémů a dalších prvků ICT, aplikací, dat a uživatelů<br>- <b>Schopnost počítačových systémů a využívaných služeb reagovat na kybernetické hrozby či útoky a jejich následky</b>, jakož i plánování obnovy funkčnosti počítačových systémů a služeb s nimi spojených<br><br><b>Smyslem</b> kybernetické bezpečnosti je zajistit jak <b>bezpečnost ICT</b> jako takových, tak i zejména <b>dat a informací</b>, které jsou těmito prvky přenášeny, zpracovávány a uchovávány.	01 01_obecne_principy_bezpecnosti kyber
01: Vysvětli pojem nebo část: Bezpečnost informací – klíčové pojmy / Aktivum	<b>– Obecné principy zajišťování bezpečnosti a dostupnosti digitálních aktiv</b><br><br>- Cokoliv, co má pro organizaci hodnotu<br>- Část hodnoceného systému či jeho dat, která mají pro společnost hodnotu<br>- <b>Informace představují majetek (aktivum) s určitou hodnotou (assets)</b><br><br>Informace musí být chráněna:<br>- Před neoprávněným přístupem<br>- Před zcizením, zfalšováním a zneužitím<br>- Před vyzrazením<br>- Před zablokováním přístupu oprávněným subjektům<br><br>Informace je chráněna v souladu s <b>informační bezpečnostní politikou (BP)</b> organizace, jejímž je majetkem.	01 01_obecne_principy_bezpecnosti kyber
01: Vysvětli pojem nebo část: Bezpečnost informací – klíčové pojmy / Hrozba	<b>– Obecné principy zajišťování bezpečnosti a dostupnosti digitálních aktiv</b><br><br>- Potenciální příčina nechtěného incidentu, jehož výsledkem může být poškození systému nebo organizace<br>- Jakákoliv aktivita využívající <b>úmyslně či neúmyslně zranitelnosti</b> s negativním dopadem na důvěrnost, dostupnost a integritu aktiv<br>- Vyjádřena <b>pravděpodobností výskytu hrozby</b><br><br><b>Příklady hrozeb:</b><br>- Porušení bezpečnostní politiky, provedení neoprávněných činností, zneužití oprávnění ze strany uživatelů a administrátorů<br>- Škodlivý kód (viry, spyware, trojské koně)<br>- Narušení fyzické bezpečnosti<br>- Přerušení poskytování služeb elektronických komunikací nebo dodávek elektrické energie<br>- Pochybení ze strany zaměstnanců<br>- Nedostatek zaměstnanců s potřebnou odbornou úrovní<br>- Cílený kybernetický útok pomocí sociálního inženýrství, použití špionážních technik<br>- Napadení elektronické komunikace (odposlech, modifikace)	01 01_obecne_principy_bezpecnosti kyber
01: Vysvětli pojem nebo část: Bezpečnost informací – klíčové pojmy / Zranitelnost	<b>– Obecné principy zajišťování bezpečnosti a dostupnosti digitálních aktiv</b><br><br>- Slabé místo aktiva nebo slabé místo bezpečnostního opatření, které může být zneužito jednou nebo více hrozbami<br>- Vyjádření slabého místa aktiva nebo skupiny aktiv, které za určitého předpokladu bude využito hrozbou s následkem poškození nebo ztráty aktiv<br><br><b>Příklady zranitelností:</b><br>- Zastaralost informačního a komunikačního systému<br>- Nedostatečné bezpečnostní povědomí uživatelů a administrátorů<br>- Nedostatečné monitorování činnosti uživatelů a administrátorů a neschopnost odhalit jejich nevhodné nebo závadné způsoby chování<br>- Nedostatečná ochrana aktiv<br>- Nevhodná bezpečnostní architektura<br>- Nedostatečná míra nezávislé kontroly	01 01_obecne_principy_bezpecnosti kyber
01: Vysvětli pojem nebo část: Bezpečnost informací – klíčové pojmy / Riziko	<b>– Obecné principy zajišťování bezpečnosti a dostupnosti digitálních aktiv</b><br><br>&gt; <b>Riziko = Dopad na aktivum (A) × Hrozba (T) × Zranitelnost (V)</b><br>&gt; neboli <b>R = T × A × V</b><br><br>[obrázek: Model vztahu aktiv, hrozeb, zranitelností, rizik a opatření]<br><br>``<code><br>HROZBA ──využívá──► ZRANITELNOST<br>  │                      │ je vlastností<br>  │ generuje         ▼<br>  │              AKTIVUM<br>  ▼                  │ má<br>RIZIKO ◄─generuje─  HODNOTA<br>  │<br>  └─indikuje─► POŽADAVKY NA OCHRANU ──zavedením──► OPATŘENÍ ──snižuje──► RIZIKO<br>                                                                chrání před HROZBOU<br></code>``	01 01_obecne_principy_bezpecnosti kyber
01: Vysvětli pojem nebo část: Typy aktiv / Primární aktiva	<b>– Obecné principy zajišťování bezpečnosti a dostupnosti digitálních aktiv</b><br><br>Informace nebo služba, kterou zpracovává nebo poskytuje informační systém kritické informační infrastruktury, komunikační systém kritické informační infrastruktury nebo významný informační systém.<br><br>| Typ | Popis |<br>|-----|-------|<br>| <b>Informační aktiva</b> | Informace uložené v IS a dokumentech společnosti. Bez těchto dat by společnost nebyla schopna účinného rozhodování a nebyla by schopna naplňovat své cíle. |<br>| <b>Služby IT</b> | Informační a komunikační služby, které podporují hlavní činnosti organizace. Jsou ve vrcholové úrovni sepsány do <b>Katalogu služeb</b>. |<br>| <b>Znalosti</b> | Vědomosti, bez kterých by organizace nemohla úspěšně fungovat. V dnešní době je přenos a zachování znalostí (kontinua znalostí) ve firmě zásadní. |	01 01_obecne_principy_bezpecnosti kyber
01: Co znamená / jakou roli má „Informační aktiva“ v části Primární aktiva?	<b>Popis</b>: Informace uložené v IS a dokumentech společnosti. Bez těchto dat by společnost nebyla schopna účinného rozhodování a nebyla by schopna naplňovat své cíle.	01 01_obecne_principy_bezpecnosti kyber tabulka
01: Co znamená / jakou roli má „Služby IT“ v části Primární aktiva?	<b>Popis</b>: Informační a komunikační služby, které podporují hlavní činnosti organizace. Jsou ve vrcholové úrovni sepsány do <b>Katalogu služeb</b>.	01 01_obecne_principy_bezpecnosti kyber tabulka
01: Co znamená / jakou roli má „Znalosti“ v části Primární aktiva?	<b>Popis</b>: Vědomosti, bez kterých by organizace nemohla úspěšně fungovat. V dnešní době je přenos a zachování znalostí (kontinua znalostí) ve firmě zásadní.	01 01_obecne_principy_bezpecnosti kyber tabulka
01: Vysvětli pojem nebo část: Typy aktiv / Podpůrná aktiva	<b>– Obecné principy zajišťování bezpečnosti a dostupnosti digitálních aktiv</b><br><br>Technická aktiva, zaměstnanci a dodavatelé podílející se na provozu, rozvoji, správě nebo bezpečnosti IS.<br><br>| Typ | Popis | Příklady |<br>|-----|-------|---------|<br>| <b>Objekty</b> | Prostředky pro zajištění fyzické bezpečnosti | trezory, zámky, elektronické zóny, bezpečnostní dveře |<br>| <b>Technologie</b> | Softwarové a hardwarové vybavení (neobsahující data) | servery, SW, síťové prvky |<br>| <b>Procesy IT</b> | Pravidla, principy, postupy a činnosti podporující provoz IT | bezpečnostní politiky, postupy |<br>| <b>Osoby</b> | Pracovníci starající se o fungování primárních aktiv | administrátor, programátor, operátor helpdesku |<br>| <b>Dodavatelé</b> | Pracovníci zajišťující funkcionalitu a funkčnost služeb IT, kteří nejsou zaměstnanci společnosti | externí IT firmy |	01 01_obecne_principy_bezpecnosti kyber
01: Co znamená / jakou roli má „Objekty“ v části Podpůrná aktiva?	<b>Popis</b>: Prostředky pro zajištění fyzické bezpečnosti<br><b>Příklady</b>: trezory, zámky, elektronické zóny, bezpečnostní dveře	01 01_obecne_principy_bezpecnosti kyber tabulka
01: Co znamená / jakou roli má „Technologie“ v části Podpůrná aktiva?	<b>Popis</b>: Softwarové a hardwarové vybavení (neobsahující data)<br><b>Příklady</b>: servery, SW, síťové prvky	01 01_obecne_principy_bezpecnosti kyber tabulka
01: Co znamená / jakou roli má „Procesy IT“ v části Podpůrná aktiva?	<b>Popis</b>: Pravidla, principy, postupy a činnosti podporující provoz IT<br><b>Příklady</b>: bezpečnostní politiky, postupy	01 01_obecne_principy_bezpecnosti kyber tabulka
01: Co znamená / jakou roli má „Osoby“ v části Podpůrná aktiva?	<b>Popis</b>: Pracovníci starající se o fungování primárních aktiv<br><b>Příklady</b>: administrátor, programátor, operátor helpdesku	01 01_obecne_principy_bezpecnosti kyber tabulka
01: Co znamená / jakou roli má „Dodavatelé“ v části Podpůrná aktiva?	<b>Popis</b>: Pracovníci zajišťující funkcionalitu a funkčnost služeb IT, kteří nejsou zaměstnanci společnosti<br><b>Příklady</b>: externí IT firmy	01 01_obecne_principy_bezpecnosti kyber tabulka
01: Vysvětli pojem nebo část: Typy aktiv / Atributy aktiva	<b>– Obecné principy zajišťování bezpečnosti a dostupnosti digitálních aktiv</b><br><br>Každé aktivum má tyto atributy:<br>- <b>Název</b> (např. server Dell PowerEdge, program GINIS, vedoucí IT)<br>- <b>Kategorie</b> (primární nebo podpůrné)<br>- <b>Typ</b> (např. server, účetní systém, vedoucí pracovníci)<br>- <b>Garant</b> (např. vedoucí IT, vedoucí účtárny)<br>- <b>Lokalizace</b> (např. Praha, Brno)<br>- <b>Hodnocení</b> (Integrita, Dostupnost, Důvěrnost)<br>- <b>Nadřazená / Podřízená aktiva</b>	01 01_obecne_principy_bezpecnosti kyber
01: Vysvětli pojem nebo část: CIA Triáda – metriky aktiv	<b>– Obecné principy zajišťování bezpečnosti a dostupnosti digitálních aktiv</b><br><br>Při uplatňování kybernetické bezpečnosti dochází k implementaci principů nazývaných <b>triády kybernetické bezpečnosti</b>:<br>1. <b>CIA</b> [C – Confidentiality (důvěrnost); I – Integrity (celistvost); A – Availability (dostupnost)]<br>2. <b>Prvky KB</b> (Lidé, Technologie, Procesy)<br>3. <b>Životní cyklus KB</b> (Prevence, Detekce, Reakce)	01 01_obecne_principy_bezpecnosti kyber
01: Vysvětli pojem nebo část: CIA Triáda – metriky aktiv / Důvěrnost (Confidentiality – C)	"<b>– Obecné principy zajišťování bezpečnosti a dostupnosti digitálních aktiv</b><br><br>&gt; „S aktivem může pracovat pouze entita, která k tomu je autorizovaná.""<br><br>Schopnost systému zajistit, aby pouze správný autorizovaný uživatel/systém/zdroj mohl prohlížet, přistupovat, měnit nebo jinak používat data.<br><br><b>Zajištění:</b><br>- Řízení a zaznamenávání přístupu<br>- Přenosy informací v komunikační síti chránit pomocí kryptografických prostředků"	01 01_obecne_principy_bezpecnosti kyber
01: Vysvětli pojem nebo část: CIA Triáda – metriky aktiv / Hodnocení úrovně důvěrnosti	<b>– Obecné principy zajišťování bezpečnosti a dostupnosti digitálních aktiv</b><br><br>| Úroveň | Popis | Ochrana |<br>|--------|-------|---------|<br>| <b>Nízká</b> | Aktiva jsou veřejně přístupná nebo určena ke zveřejnění. Narušení neohrožuje oprávněné zájmy. | Není vyžadována žádná ochrana. Likvidace/mazání aktiva na úrovni Nízká. |<br>| <b>Střední</b> | Aktiva nejsou veřejně přístupná a tvoří know-how; ochrana není vyžadována žádným právním předpisem. | Pro ochranu jsou využívány prostředky pro řízení přístupu. Likvidace/mazání na úrovni Střední. |<br>| <b>Vysoká</b> | Aktiva nejsou veřejně přístupná a jejich ochrana je vyžadována právními předpisy (obchodní tajemství, osobní údaje). | Řízení a zaznamenávání přístupu + kryptografická ochrana přenosů + likvidace na úrovni Vysoká. |<br>| <b>Kritická</b> | Aktiva vyžadují nadstandardní míru ochrany (strategické obchodní tajemství, zvláštní kategorie osobních údajů). | Vše jako Vysoká + metody ochrany zabraňující zneužití ze strany administrátorů. |	01 01_obecne_principy_bezpecnosti kyber
01: Co znamená / jakou roli má „Nízká“ v části Hodnocení úrovně důvěrnosti?	<b>Popis</b>: Aktiva jsou veřejně přístupná nebo určena ke zveřejnění. Narušení neohrožuje oprávněné zájmy.<br><b>Ochrana</b>: Není vyžadována žádná ochrana. Likvidace/mazání aktiva na úrovni Nízká.	01 01_obecne_principy_bezpecnosti kyber tabulka
01: Co znamená / jakou roli má „Střední“ v části Hodnocení úrovně důvěrnosti?	<b>Popis</b>: Aktiva nejsou veřejně přístupná a tvoří know-how; ochrana není vyžadována žádným právním předpisem.<br><b>Ochrana</b>: Pro ochranu jsou využívány prostředky pro řízení přístupu. Likvidace/mazání na úrovni Střední.	01 01_obecne_principy_bezpecnosti kyber tabulka
01: Co znamená / jakou roli má „Vysoká“ v části Hodnocení úrovně důvěrnosti?	<b>Popis</b>: Aktiva nejsou veřejně přístupná a jejich ochrana je vyžadována právními předpisy (obchodní tajemství, osobní údaje).<br><b>Ochrana</b>: Řízení a zaznamenávání přístupu + kryptografická ochrana přenosů + likvidace na úrovni Vysoká.	01 01_obecne_principy_bezpecnosti kyber tabulka
01: Co znamená / jakou roli má „Kritická“ v části Hodnocení úrovně důvěrnosti?	<b>Popis</b>: Aktiva vyžadují nadstandardní míru ochrany (strategické obchodní tajemství, zvláštní kategorie osobních údajů).<br><b>Ochrana</b>: Vše jako Vysoká + metody ochrany zabraňující zneužití ze strany administrátorů.	01 01_obecne_principy_bezpecnosti kyber tabulka
01: Vysvětli pojem nebo část: CIA Triáda – metriky aktiv / Integrita (Integrity – I)	"<b>– Obecné principy zajišťování bezpečnosti a dostupnosti digitálních aktiv</b><br><br>&gt; „Aktivum nesmí být změněno, vytvořeno a odstraněno bez autorizovaného přístupu.""<br><br>- <b>Integrita dat</b> – „jistota, že data nebyla změněna. Přeneseně označuje i platnost, konzistenci a přesnost dat, např. databází nebo systémů souborů. Bývá zajišťována kontrolními součty, hašovacími funkcemi, samoopravnými kódy, redundancí, žurnálováním atd.""<br>- <b>Integrita systému</b> – „vlastnost, že systém vykonává svou zamýšlenou funkci nenarušeným způsobem, bez záměrné nebo náhodné neautomatizované manipulace se systémem.""<br>- Integrita představuje <b>nemožnost zásahu do informací, dat, počítačových systémů, jejich nastavení atp.</b> jinou osobou, než tou, která je k takovému úkonu oprávněna.<br><br><b>Zajištění:</b><br>- Prostředky dovolující sledovat historii provedených změn a zaznamenat identitu osoby provádějící změnu<br>- Ochrana integrity informací přenášených komunikačními sítěmi je zajištěna pomocí kryptografických prostředků"	01 01_obecne_principy_bezpecnosti kyber
01: Vysvětli pojem nebo část: CIA Triáda – metriky aktiv / Hodnocení úrovně integrity	<b>– Obecné principy zajišťování bezpečnosti a dostupnosti digitálních aktiv</b><br><br>| Úroveň | Popis | Ochrana |<br>|--------|-------|---------|<br>| <b>Nízká</b> | Narušení integrity aktiva neohrožuje oprávněné zájmy povinné osoby. | Není vyžadována žádná ochrana. |<br>| <b>Střední</b> | Narušení může vést k poškození oprávněných zájmů s méně závažnými dopady na primární aktiva. | Standardní nástroje (např. omezení přístupových práv pro zápis). |<br>| <b>Vysoká</b> | Narušení integrity vede k poškození oprávněných zájmů s podstatnými dopady na primární aktiva. | Speciální prostředky pro sledování historie změn + kryptografická ochrana přenosů. |<br>| <b>Kritická</b> | Narušení integrity vede k velmi vážnému poškození s přímými a velmi vážnými dopady na primární aktiva. | Speciální prostředky jednoznačné identifikace osoby provádějící změnu (např. digitální podpis). |	01 01_obecne_principy_bezpecnosti kyber
01: Co znamená / jakou roli má „Nízká“ v části Hodnocení úrovně integrity?	<b>Popis</b>: Narušení integrity aktiva neohrožuje oprávněné zájmy povinné osoby.<br><b>Ochrana</b>: Není vyžadována žádná ochrana.	01 01_obecne_principy_bezpecnosti kyber tabulka
01: Co znamená / jakou roli má „Střední“ v části Hodnocení úrovně integrity?	<b>Popis</b>: Narušení může vést k poškození oprávněných zájmů s méně závažnými dopady na primární aktiva.<br><b>Ochrana</b>: Standardní nástroje (např. omezení přístupových práv pro zápis).	01 01_obecne_principy_bezpecnosti kyber tabulka
01: Co znamená / jakou roli má „Vysoká“ v části Hodnocení úrovně integrity?	<b>Popis</b>: Narušení integrity vede k poškození oprávněných zájmů s podstatnými dopady na primární aktiva.<br><b>Ochrana</b>: Speciální prostředky pro sledování historie změn + kryptografická ochrana přenosů.	01 01_obecne_principy_bezpecnosti kyber tabulka
01: Co znamená / jakou roli má „Kritická“ v části Hodnocení úrovně integrity?	<b>Popis</b>: Narušení integrity vede k velmi vážnému poškození s přímými a velmi vážnými dopady na primární aktiva.<br><b>Ochrana</b>: Speciální prostředky jednoznačné identifikace osoby provádějící změnu (např. digitální podpis).	01 01_obecne_principy_bezpecnosti kyber tabulka
01: Vysvětli pojem nebo část: CIA Triáda – metriky aktiv / Dostupnost (Availability – A)	"<b>– Obecné principy zajišťování bezpečnosti a dostupnosti digitálních aktiv</b><br><br>&gt; „Vlastnost přístupnosti a použitelnosti na žádost oprávněné entity.""<br><br>- Garance možnosti přístupu k informaci, datům, nebo počítačovému systému v okamžiku potřeby<br>- „O zničení (destruction) určitých informací se v informační bezpečnosti hovoří jako o narušení jejich dostupnosti (availability).""<br><br><b>Zajištění:</b><br>- Zálohování a obnova<br>- Využívání záložních systémů; obnova poskytování služeb je krátkodobá a automatizovaná"	01 01_obecne_principy_bezpecnosti kyber
01: Vysvětli pojem nebo část: CIA Triáda – metriky aktiv / Hodnocení úrovně dostupnosti	<b>– Obecné principy zajišťování bezpečnosti a dostupnosti digitálních aktiv</b><br><br>| Úroveň | Popis | Ochrana |<br>|--------|-------|---------|<br>| <b>Nízká</b> | Narušení dostupnosti není důležité, tolerováno delší časové období pro nápravu (cca do 1 týdne). | Postačující pravidelné zálohování. |<br>| <b>Střední</b> | Narušení by nemělo překročit dobu pracovního dne, delší výpadek vede k možnému ohrožení zájmů. | Běžné metody zálohování a obnovy. |<br>| <b>Vysoká</b> | Narušení by nemělo překročit dobu několika hodin. Jakýkoli výpadek nutné řešit neprodleně (přímé ohrožení zájmů). | Záložní systémy, obnova může být podmíněna zásahy obsluhy nebo výměnou technických aktiv. |<br>| <b>Kritická</b> | Narušení dostupnosti není přípustné; krátkodobá nedostupnost (minuty) vede k vážnému ohrožení. Aktiva jsou kritická. | Záložní systémy, obnova je krátkodobá a <b>automatizovaná</b>. |	01 01_obecne_principy_bezpecnosti kyber
01: Co znamená / jakou roli má „Nízká“ v části Hodnocení úrovně dostupnosti?	<b>Popis</b>: Narušení dostupnosti není důležité, tolerováno delší časové období pro nápravu (cca do 1 týdne).<br><b>Ochrana</b>: Postačující pravidelné zálohování.	01 01_obecne_principy_bezpecnosti kyber tabulka
01: Co znamená / jakou roli má „Střední“ v části Hodnocení úrovně dostupnosti?	<b>Popis</b>: Narušení by nemělo překročit dobu pracovního dne, delší výpadek vede k možnému ohrožení zájmů.<br><b>Ochrana</b>: Běžné metody zálohování a obnovy.	01 01_obecne_principy_bezpecnosti kyber tabulka
01: Co znamená / jakou roli má „Vysoká“ v části Hodnocení úrovně dostupnosti?	<b>Popis</b>: Narušení by nemělo překročit dobu několika hodin. Jakýkoli výpadek nutné řešit neprodleně (přímé ohrožení zájmů).<br><b>Ochrana</b>: Záložní systémy, obnova může být podmíněna zásahy obsluhy nebo výměnou technických aktiv.	01 01_obecne_principy_bezpecnosti kyber tabulka
01: Co znamená / jakou roli má „Kritická“ v části Hodnocení úrovně dostupnosti?	<b>Popis</b>: Narušení dostupnosti není přípustné; krátkodobá nedostupnost (minuty) vede k vážnému ohrožení. Aktiva jsou kritická.<br><b>Ochrana</b>: Záložní systémy, obnova je krátkodobá a <b>automatizovaná</b>.	01 01_obecne_principy_bezpecnosti kyber tabulka
01: Vysvětli pojem nebo část: Klasifikace informací / Státní klasifikace (zákon 412/2005 Sb., o ochraně utajovaných informací a o bezpečnostní způsobilosti)	<b>– Obecné principy zajišťování bezpečnosti a dostupnosti digitálních aktiv</b><br><br>| Stupeň | Anglický ekvivalent | Dopad |<br>|--------|--------------------|----|<br>| <b>Přísně tajné</b> | Top secret | Neoprávněné nakládání by mohlo způsobit <b>mimořádně vážnou újmu</b> zájmům České republiky |<br>| <b>Tajné</b> | Secret | Neoprávněné nakládání by mohlo způsobit <b>vážnou újmu</b> zájmům České republiky |<br>| <b>Důvěrné</b> | Confidential | Neoprávněné nakládání by mohlo způsobit <b>prostou újmu</b> zájmům České republiky |<br>| <b>Vyhrazené</b> | Restricted | Neoprávněné nakládání by mohlo být <b>nevýhodné</b> pro zájmy České republiky |	01 01_obecne_principy_bezpecnosti kyber
01: Co znamená / jakou roli má „Přísně tajné“ v části Státní klasifikace (zákon 412/2005 Sb., o ochraně utajovaných informací a o bezpečnostní způsobilosti)?	<b>Anglický ekvivalent</b>: Top secret<br><b>Dopad</b>: Neoprávněné nakládání by mohlo způsobit <b>mimořádně vážnou újmu</b> zájmům České republiky	01 01_obecne_principy_bezpecnosti kyber tabulka
01: Co znamená / jakou roli má „Tajné“ v části Státní klasifikace (zákon 412/2005 Sb., o ochraně utajovaných informací a o bezpečnostní způsobilosti)?	<b>Anglický ekvivalent</b>: Secret<br><b>Dopad</b>: Neoprávněné nakládání by mohlo způsobit <b>vážnou újmu</b> zájmům České republiky	01 01_obecne_principy_bezpecnosti kyber tabulka
01: Co znamená / jakou roli má „Důvěrné“ v části Státní klasifikace (zákon 412/2005 Sb., o ochraně utajovaných informací a o bezpečnostní způsobilosti)?	<b>Anglický ekvivalent</b>: Confidential<br><b>Dopad</b>: Neoprávněné nakládání by mohlo způsobit <b>prostou újmu</b> zájmům České republiky	01 01_obecne_principy_bezpecnosti kyber tabulka
01: Co znamená / jakou roli má „Vyhrazené“ v části Státní klasifikace (zákon 412/2005 Sb., o ochraně utajovaných informací a o bezpečnostní způsobilosti)?	<b>Anglický ekvivalent</b>: Restricted<br><b>Dopad</b>: Neoprávněné nakládání by mohlo být <b>nevýhodné</b> pro zájmy České republiky	01 01_obecne_principy_bezpecnosti kyber tabulka
01: Vysvětli pojem nebo část: Klasifikace informací / Komerční klasifikace	<b>– Obecné principy zajišťování bezpečnosti a dostupnosti digitálních aktiv</b><br><br>| Stupeň | Dopad | Příklady |<br>|--------|-------|---------|<br>| <b>Chráněné</b> | Závažné poškození či zničení organizace | Únik strategických informací, zdrojových kódů, schémat zabezpečení, hesel |<br>| <b>Interní</b> | Poškození organizace | Únik osobních údajů, smluv |<br>| <b>Citlivé</b> | Negativní dopad na společnost | Dosud nezveřejněné informace o projektech, plánovaných akcích |<br>| <b>Veřejné</b> | Bez dopadu | Veřejně dostupné kontakty, prezentace projektů |	01 01_obecne_principy_bezpecnosti kyber
01: Co znamená / jakou roli má „Chráněné“ v části Komerční klasifikace?	<b>Dopad</b>: Závažné poškození či zničení organizace<br><b>Příklady</b>: Únik strategických informací, zdrojových kódů, schémat zabezpečení, hesel	01 01_obecne_principy_bezpecnosti kyber tabulka
01: Co znamená / jakou roli má „Interní“ v části Komerční klasifikace?	<b>Dopad</b>: Poškození organizace<br><b>Příklady</b>: Únik osobních údajů, smluv	01 01_obecne_principy_bezpecnosti kyber tabulka
01: Co znamená / jakou roli má „Citlivé“ v části Komerční klasifikace?	<b>Dopad</b>: Negativní dopad na společnost<br><b>Příklady</b>: Dosud nezveřejněné informace o projektech, plánovaných akcích	01 01_obecne_principy_bezpecnosti kyber tabulka
01: Co znamená / jakou roli má „Veřejné“ v části Komerční klasifikace?	<b>Dopad</b>: Bez dopadu<br><b>Příklady</b>: Veřejně dostupné kontakty, prezentace projektů	01 01_obecne_principy_bezpecnosti kyber tabulka
